<?xml version="1.0" encoding="UTF-8"?>
<botiga xmlns:xsi="http://www.w3.org/2001/XMLSchema-instance"
        xsi:noNamespaceSchemaLocation="botiga.xsd">
  <producte id="P001" estat="nou">
    <nom>Portàtil Gaming</nom>
    <preu>1299.99</preu>
    <stock>15</stock>
    <categoria>informatica</categoria>
    <marca>ASUS</marca>
    <etiqueta>gaming</etiqueta>
    <etiqueta>portatil</etiqueta>
  </producte>
  <producte id="P002" estat="oferta">
    <nom>El Senyor dels Anells</nom>
    <preu>12.50</preu>
    <stock>42</stock>
    <categoria>llibres</categoria>
    <etiqueta>fantasia</etiqueta>
  </producte>
</botiga>